{
  "artifactKind": "read-allowlist",
  "counts": {
    "rows": 232
  },
  "generatedAt": "2026-06-03T01:20:07Z",
  "generatedFrom": [
    ".config/ags/widget/hyprland-settings/currentValueAllowlist.ts"
  ],
  "hyprlandVersion": "0.55.2",
  "items": [
    {
      "commandStringIncluded": false,
      "liveValuePayloadIncluded": false,
      "officialSetting": "decoration.blur.enabled",
      "parser": "hyprctl-getoption-bool",
      "readStrategy": "current-value-scalar-read",
      "readSupportSource": ".config/ags/widget/hyprland-settings/currentValueAllowlist.ts",
      "rowId": "appearance.blur.enabled",
      "safetyNotes": "Read-only official Hyprland scalar value.",
      "scalarOnly": true
    },
    {
      "commandStringIncluded": false,
      "liveValuePayloadIncluded": false,
      "officialSetting": "decoration.blur.size",
      "parser": "hyprctl-getoption-number",
      "readStrategy": "current-value-scalar-read",
      "readSupportSource": ".config/ags/widget/hyprland-settings/currentValueAllowlist.ts",
      "rowId": "appearance.blur.size",
      "safetyNotes": "Read-only official Hyprland scalar value.",
      "scalarOnly": true
    },
    {
      "commandStringIncluded": false,
      "liveValuePayloadIncluded": false,
      "officialSetting": "decoration.blur.passes",
      "parser": "hyprctl-getoption-number",
      "readStrategy": "current-value-scalar-read",
      "readSupportSource": ".config/ags/widget/hyprland-settings/currentValueAllowlist.ts",
      "rowId": "appearance.blur.passes",
      "safetyNotes": "Read-only official Hyprland scalar value.",
      "scalarOnly": true
    },
    {
      "commandStringIncluded": false,
      "liveValuePayloadIncluded": false,
      "officialSetting": "decoration.blur.brightness",
      "parser": "hyprctl-getoption-number",
      "readStrategy": "current-value-scalar-read",
      "readSupportSource": ".config/ags/widget/hyprland-settings/currentValueAllowlist.ts",
      "rowId": "appearance.blur.brightness",
      "safetyNotes": "Read-only official Hyprland scalar value.",
      "scalarOnly": true
    },
    {
      "commandStringIncluded": false,
      "liveValuePayloadIncluded": false,
      "officialSetting": "decoration.blur.contrast",
      "parser": "hyprctl-getoption-number",
      "readStrategy": "current-value-scalar-read",
      "readSupportSource": ".config/ags/widget/hyprland-settings/currentValueAllowlist.ts",
      "rowId": "appearance.blur.contrast",
      "safetyNotes": "Read-only official Hyprland scalar value.",
      "scalarOnly": true
    },
    {
      "commandStringIncluded": false,
      "liveValuePayloadIncluded": false,
      "officialSetting": "decoration.blur.noise",
      "parser": "hyprctl-getoption-number",
      "readStrategy": "current-value-scalar-read",
      "readSupportSource": ".config/ags/widget/hyprland-settings/currentValueAllowlist.ts",
      "rowId": "appearance.blur.noise",
      "safetyNotes": "Read-only official Hyprland scalar value.",
      "scalarOnly": true
    },
    {
      "commandStringIncluded": false,
      "liveValuePayloadIncluded": false,
      "officialSetting": "decoration.shadow.enabled",
      "parser": "hyprctl-getoption-bool",
      "readStrategy": "current-value-scalar-read",
      "readSupportSource": ".config/ags/widget/hyprland-settings/currentValueAllowlist.ts",
      "rowId": "appearance.shadow.enabled",
      "safetyNotes": "Read-only official Hyprland scalar value.",
      "scalarOnly": true
    },
    {
      "commandStringIncluded": false,
      "liveValuePayloadIncluded": false,
      "officialSetting": "decoration.shadow.range",
      "parser": "hyprctl-getoption-number",
      "readStrategy": "current-value-scalar-read",
      "readSupportSource": ".config/ags/widget/hyprland-settings/currentValueAllowlist.ts",
      "rowId": "appearance.shadow.range",
      "safetyNotes": "Read-only official Hyprland scalar value.",
      "scalarOnly": true
    },
    {
      "commandStringIncluded": false,
      "liveValuePayloadIncluded": false,
      "officialSetting": "decoration.shadow.render_power",
      "parser": "hyprctl-getoption-number",
      "readStrategy": "current-value-scalar-read",
      "readSupportSource": ".config/ags/widget/hyprland-settings/currentValueAllowlist.ts",
      "rowId": "appearance.shadow.render_power",
      "safetyNotes": "Read-only official Hyprland scalar value.",
      "scalarOnly": true
    },
    {
      "commandStringIncluded": false,
      "liveValuePayloadIncluded": false,
      "officialSetting": "decoration.shadow.scale",
      "parser": "hyprctl-getoption-number",
      "readStrategy": "current-value-scalar-read",
      "readSupportSource": ".config/ags/widget/hyprland-settings/currentValueAllowlist.ts",
      "rowId": "appearance.shadow.scale",
      "safetyNotes": "Read-only official Hyprland scalar value.",
      "scalarOnly": true
    },
    {
      "commandStringIncluded": false,
      "liveValuePayloadIncluded": false,
      "officialSetting": "general.gaps_in",
      "parser": "hyprctl-getoption-css-gap",
      "readStrategy": "current-value-scalar-read",
      "readSupportSource": ".config/ags/widget/hyprland-settings/currentValueAllowlist.ts",
      "rowId": "appearance.gaps_in",
      "safetyNotes": "Read-only official Hyprland scalar value.",
      "scalarOnly": true
    },
    {
      "commandStringIncluded": false,
      "liveValuePayloadIncluded": false,
      "officialSetting": "general.gaps_out",
      "parser": "hyprctl-getoption-css-gap",
      "readStrategy": "current-value-scalar-read",
      "readSupportSource": ".config/ags/widget/hyprland-settings/currentValueAllowlist.ts",
      "rowId": "appearance.gaps_out",
      "safetyNotes": "Read-only official Hyprland scalar value.",
      "scalarOnly": true
    },
    {
      "commandStringIncluded": false,
      "liveValuePayloadIncluded": false,
      "officialSetting": "general.border_size",
      "parser": "hyprctl-getoption-number",
      "readStrategy": "current-value-scalar-read",
      "readSupportSource": ".config/ags/widget/hyprland-settings/currentValueAllowlist.ts",
      "rowId": "appearance.border_size",
      "safetyNotes": "Read-only official Hyprland scalar value.",
      "scalarOnly": true
    },
    {
      "commandStringIncluded": false,
      "liveValuePayloadIncluded": false,
      "officialSetting": "decoration.rounding",
      "parser": "hyprctl-getoption-number",
      "readStrategy": "current-value-scalar-read",
      "readSupportSource": ".config/ags/widget/hyprland-settings/currentValueAllowlist.ts",
      "rowId": "appearance.rounding",
      "safetyNotes": "Read-only official Hyprland scalar value.",
      "scalarOnly": true
    },
    {
      "commandStringIncluded": false,
      "liveValuePayloadIncluded": false,
      "officialSetting": "decoration.rounding_power",
      "parser": "hyprctl-getoption-number",
      "readStrategy": "current-value-scalar-read",
      "readSupportSource": ".config/ags/widget/hyprland-settings/currentValueAllowlist.ts",
      "rowId": "appearance.rounding_power",
      "safetyNotes": "Read-only official Hyprland scalar value.",
      "scalarOnly": true
    },
    {
      "commandStringIncluded": false,
      "liveValuePayloadIncluded": false,
      "officialSetting": "decoration.active_opacity",
      "parser": "hyprctl-getoption-number",
      "readStrategy": "current-value-scalar-read",
      "readSupportSource": ".config/ags/widget/hyprland-settings/currentValueAllowlist.ts",
      "rowId": "appearance.active_opacity",
      "safetyNotes": "Read-only official Hyprland scalar value.",
      "scalarOnly": true
    },
    {
      "commandStringIncluded": false,
      "liveValuePayloadIncluded": false,
      "officialSetting": "decoration.inactive_opacity",
      "parser": "hyprctl-getoption-number",
      "readStrategy": "current-value-scalar-read",
      "readSupportSource": ".config/ags/widget/hyprland-settings/currentValueAllowlist.ts",
      "rowId": "appearance.inactive_opacity",
      "safetyNotes": "Read-only official Hyprland scalar value.",
      "scalarOnly": true
    },
    {
      "commandStringIncluded": false,
      "liveValuePayloadIncluded": false,
      "officialSetting": "decoration.fullscreen_opacity",
      "parser": "hyprctl-getoption-number",
      "readStrategy": "current-value-scalar-read",
      "readSupportSource": ".config/ags/widget/hyprland-settings/currentValueAllowlist.ts",
      "rowId": "appearance.fullscreen_opacity",
      "safetyNotes": "Read-only official Hyprland scalar value.",
      "scalarOnly": true
    },
    {
      "commandStringIncluded": false,
      "liveValuePayloadIncluded": false,
      "officialSetting": "decoration.dim_modal",
      "parser": "hyprctl-getoption-bool",
      "readStrategy": "current-value-scalar-read",
      "readSupportSource": ".config/ags/widget/hyprland-settings/currentValueAllowlist.ts",
      "rowId": "appearance.dim.modal",
      "safetyNotes": "Read-only official Hyprland scalar value.",
      "scalarOnly": true
    },
    {
      "commandStringIncluded": false,
      "liveValuePayloadIncluded": false,
      "officialSetting": "decoration.dim_inactive",
      "parser": "hyprctl-getoption-bool",
      "readStrategy": "current-value-scalar-read",
      "readSupportSource": ".config/ags/widget/hyprland-settings/currentValueAllowlist.ts",
      "rowId": "appearance.dim.inactive",
      "safetyNotes": "Read-only official Hyprland scalar value.",
      "scalarOnly": true
    },
    {
      "commandStringIncluded": false,
      "liveValuePayloadIncluded": false,
      "officialSetting": "decoration.dim_strength",
      "parser": "hyprctl-getoption-number",
      "readStrategy": "current-value-scalar-read",
      "readSupportSource": ".config/ags/widget/hyprland-settings/currentValueAllowlist.ts",
      "rowId": "appearance.dim.strength",
      "safetyNotes": "Read-only official Hyprland scalar value.",
      "scalarOnly": true
    },
    {